{
  "$schema": "https://json-schema.org/draft/2020-12/schema",
  "$id": "https://gonka-dev.net/v1.bootstrap.schema.json",
  "title": "Gonka Network Bootstrap",
  "type": "object",
  "additionalProperties": false,
  "required": [
    "$schema",
    "chain_id",
    "genesis",
    "seeds",
    "brokers"
  ],
  "properties": {
    "$schema": {
      "const": "https://gonka-dev.net/v1.bootstrap.schema.json"
    },
    "chain_id": {
      "type": "string",
      "pattern": "^[A-Za-z0-9][A-Za-z0-9._-]{0,127}$"
    },
    "genesis": {
      "type": "object",
      "additionalProperties": false,
      "required": [
        "sha256"
      ],
      "properties": {
        "sha256": {
          "type": "string",
          "pattern": "^[0-9a-f]{64}$"
        }
      }
    },
    "seeds": {
      "type": "array",
      "minItems": 2,
      "items": {
        "type": "object",
        "additionalProperties": false,
        "required": [
          "node_id",
          "rpc",
          "p2p"
        ],
        "properties": {
          "node_id": {
            "type": "string",
            "pattern": "^[0-9a-f]{40}$"
          },
          "rpc": {
            "type": "string",
            "pattern": "^https?://[A-Za-z0-9.-]+(:[1-9][0-9]{0,4})?/chain-rpc/?$"
          },
          "p2p": {
            "type": "string"
          },
          "api": {
            "type": "string"
          }
        }
      }
    },
    "brokers": {
      "type": "array",
      "items": {
        "type": "object",
        "additionalProperties": false,
        "required": [
          "api_urls"
        ],
        "properties": {
          "api_urls": {
            "type": "array",
            "minItems": 1,
            "items": {
              "type": "string"
            }
          },
          "access_url": {
            "type": "string"
          }
        }
      }
    }
  }
}
