{
  "$schema": "https://gonka-dev.net/v1.bootstrap.schema.json",
  "chain_id": "gonka-devnet-community",
  "genesis": {
    "sha256": "93c32ec403d59af6337c0d79c3ee16010c99394f8ecd9aee4fc72a898f64a9a6"
  },
  "seeds": [
    {
      "node_id": "a78baa4988a9be991685080df4c232b1fdbe60ac",
      "rpc": "https://node0.gonka-dev.net/chain-rpc",
      "p2p": "tcp://node0.gonka-dev.net:5000",
      "api": "https://node0.gonka-dev.net"
    },
    {
      "node_id": "0f955d2e5ff3bdeabf04d91b5d590dc902aae4d0",
      "rpc": "https://node1.gonka-dev.net/chain-rpc",
      "p2p": "tcp://node1.gonka-dev.net:5000",
      "api": "https://node1.gonka-dev.net"
    },
    {
      "node_id": "1c62708ec56fe02d52c3ecedd388ebcc9ace55b4",
      "rpc": "https://node4.gonka-dev.net/chain-rpc",
      "p2p": "tcp://node4.gonka-dev.net:5000",
      "api": "https://node4.gonka-dev.net"
    },
    {
      "node_id": "7326a7861d5430ff11d6e76e643e7acfabe6e9c4",
      "rpc": "https://node7.gonka-dev.net/chain-rpc",
      "p2p": "tcp://node7.gonka-dev.net:5000",
      "api": "https://node7.gonka-dev.net"
    }
  ],
  "brokers": [
    {
      "api_urls": [
        "https://api.gonka-dev.net"
      ],
      "access_url": "https://gonka-dev.net"
    }
  ]
}
